{
  "$schema": "https://json-schema.org/draft/2020-12/schema",
  "$id": "https://openproof.network/schemas/attestation/v7.json",
  "title": "attestation/v7",
  "description": "v7 (2026-10-10, F25-R3; D-23 v3.37): carries `automation`, the structured disclosure the opn-submission block declared (submission-meta/v2), or null when the block carried none or the pull request was hand-opened; `model_and_tooling` is unchanged beside it. v6 could not be edited (D-34). One record per gate run (D-5, D-34 minimum fields; key names fixed by F00-Q3). Serves the authoritative gate, precheck and pregate.sh alike; they differ in runner and signature.kind. The D-5 identical-verdict comparison masks runner, merge_commit and signature only, so nothing outside those may depend on the run environment — the run timestamp therefore lives inside signature. v2 (2026-09-08, D-4 v3.11): the step-9 record is a `review` block naming what stood behind the merge — the tutorial exemption, a non-author PR approval, or the statement's certificate/provenance — replacing the bare `reviewer` string. v3 (2026-09-09, F02-R9): optional trust_base — `kernel` (the default: every axiom on the allowlist, kernel-replayed) or `compiler` (the proof used native_decide under a recorded waiver, D-4 amendment); written by every run from the checked tree, so D-5 comparisons see it, and made permanent by the post-merge job only when the approving review names the waiver. v4 (2026-09-10, F07-R13): `submitter` and `model_and_tooling` — who opened the submission and what they declared drove it (D-23, D-34). Both come from the pull request's opn-submission block; a hand-opened pull request has no block, so the submitter is the GitHub login and the tooling is `undeclared`. The block is a declaration and is never checked (D-1: the gate is blind to tooling); it is recorded so the corpus is labelled. v5 (2026-09-20, D-4 v3.20): `review.kind` gains `intermediate` (the artifact settles no root, so no reviewer was asked) and `calibration` (the target is a result already in the literature); both record why nobody was asked, with reviewer and reference null. v6 (2026-10-03, F08-T27, F18-R2; D-12 v3.25): `footprint` — the nodes the proof term rests on, as step 8 read them from the kernel term (declared dependencies it uses and declared uses alike, each read through its revision chain), so a closure by use follows from the record rather than from what a node declared. `null` when step 8 did not pass, which means not measured, never empty.",
  "type": "object",
  "additionalProperties": false,
  "required": [
    "schema",
    "graph_id",
    "node_id",
    "statement_hash",
    "lean_toolchain",
    "toolchain_hash",
    "mathlib_sha",
    "gate_spec_hash",
    "network_commit",
    "graph_commit",
    "runner",
    "tooling",
    "verdict",
    "first_failing_step",
    "diagnostic",
    "steps",
    "artifact_hash",
    "precheck_attestation",
    "merge_commit",
    "review",
    "signature",
    "submitter",
    "model_and_tooling",
    "footprint",
    "automation"
  ],
  "properties": {
    "schema": {
      "const": "attestation/v7"
    },
    "graph_id": {
      "$ref": "#/$defs/identifier"
    },
    "node_id": {
      "$ref": "#/$defs/identifier"
    },
    "statement_hash": {
      "$ref": "#/$defs/sha256"
    },
    "lean_toolchain": {
      "type": "string",
      "minLength": 1
    },
    "toolchain_hash": {
      "description": "Null only when step 1 failed before the toolchain resolved",
      "oneOf": [
        {
          "type": "null"
        },
        {
          "$ref": "#/$defs/sha256"
        }
      ]
    },
    "mathlib_sha": {
      "oneOf": [
        {
          "type": "null"
        },
        {
          "$ref": "#/$defs/sha1"
        }
      ]
    },
    "gate_spec_hash": {
      "$ref": "#/$defs/sha256"
    },
    "network_commit": {
      "$ref": "#/$defs/sha1"
    },
    "graph_commit": {
      "description": "The graph commit the checked tree came from; null for an uncommitted local tree",
      "oneOf": [
        {
          "type": "null"
        },
        {
          "$ref": "#/$defs/sha1"
        }
      ]
    },
    "runner": {
      "enum": [
        "hosted",
        "local"
      ]
    },
    "tooling": {
      "type": "object",
      "description": "Model and harness as declared by the operator (D-23); never verified",
      "additionalProperties": false,
      "required": [
        "model",
        "harness"
      ],
      "properties": {
        "model": {
          "oneOf": [
            {
              "type": "null"
            },
            {
              "type": "string",
              "minLength": 1
            }
          ]
        },
        "harness": {
          "oneOf": [
            {
              "type": "null"
            },
            {
              "type": "string",
              "minLength": 1
            }
          ]
        }
      }
    },
    "verdict": {
      "enum": [
        "pass",
        "fail",
        "bounced"
      ]
    },
    "first_failing_step": {
      "oneOf": [
        {
          "type": "null"
        },
        {
          "$ref": "#/$defs/step_number"
        }
      ]
    },
    "diagnostic": {
      "oneOf": [
        {
          "type": "null"
        },
        {
          "$ref": "#/$defs/diagnostic"
        }
      ]
    },
    "steps": {
      "type": "array",
      "description": "Every step the pipeline ran, in D-4 order, with the ones not reached marked skipped",
      "items": {
        "type": "object",
        "additionalProperties": false,
        "required": [
          "step",
          "name",
          "result",
          "diagnostic"
        ],
        "properties": {
          "step": {
            "$ref": "#/$defs/step_number"
          },
          "name": {
            "type": "string",
            "minLength": 1
          },
          "result": {
            "enum": [
              "pass",
              "fail",
              "skipped"
            ]
          },
          "diagnostic": {
            "oneOf": [
              {
                "type": "null"
              },
              {
                "$ref": "#/$defs/diagnostic"
              }
            ]
          }
        }
      }
    },
    "artifact_hash": {
      "description": "sha256 of Proof.lean as checked (D-34: the artifact hash on pass, also recorded on fail)",
      "oneOf": [
        {
          "type": "null"
        },
        {
          "$ref": "#/$defs/sha256"
        }
      ]
    },
    "precheck_attestation": {
      "type": "object",
      "description": "What the authoritative run consumed (D-4); both null when none was attached",
      "additionalProperties": false,
      "required": [
        "hash",
        "signature_kind"
      ],
      "properties": {
        "hash": {
          "oneOf": [
            {
              "type": "null"
            },
            {
              "$ref": "#/$defs/sha256"
            }
          ]
        },
        "signature_kind": {
          "oneOf": [
            {
              "type": "null"
            },
            {
              "enum": [
                "service",
                "contributor",
                "none"
              ]
            }
          ]
        }
      }
    },
    "merge_commit": {
      "oneOf": [
        {
          "type": "null"
        },
        {
          "$ref": "#/$defs/sha1"
        }
      ]
    },
    "signature": {
      "type": "object",
      "additionalProperties": false,
      "required": [
        "kind",
        "key_id",
        "value",
        "timestamp"
      ],
      "properties": {
        "kind": {
          "enum": [
            "gate",
            "service",
            "contributor",
            "none"
          ]
        },
        "key_id": {
          "oneOf": [
            {
              "type": "null"
            },
            {
              "type": "string",
              "minLength": 1
            }
          ]
        },
        "value": {
          "oneOf": [
            {
              "type": "null"
            },
            {
              "type": "string",
              "minLength": 1
            }
          ]
        },
        "timestamp": {
          "type": "string",
          "description": "UTC, second precision, Z suffix",
          "pattern": "^[0-9]{4}-[0-9]{2}-[0-9]{2}T[0-9]{2}:[0-9]{2}:[0-9]{2}Z$"
        }
      }
    },
    "review": {
      "description": "Step 9 (D-4 v3.11, v3.20): what satisfied the non-author review requirement, or why it was not asked; null until the post-merge job fills it",
      "oneOf": [
        {
          "type": "null"
        },
        {
          "type": "object",
          "additionalProperties": false,
          "required": [
            "kind",
            "reviewer",
            "reference"
          ],
          "properties": {
            "kind": {
              "enum": [
                "tutorial",
                "pr-approval",
                "certificate",
                "provenance",
                "intermediate",
                "calibration"
              ]
            },
            "reviewer": {
              "description": "The approving non-author identity (pr-approval); null otherwise",
              "oneOf": [
                {
                  "type": "null"
                },
                {
                  "type": "string",
                  "minLength": 1
                }
              ]
            },
            "reference": {
              "description": "What was relied on: the D-9 certificate id, the D-10 registry reference, or null",
              "oneOf": [
                {
                  "type": "null"
                },
                {
                  "type": "string",
                  "minLength": 1
                }
              ]
            }
          }
        }
      ]
    },
    "trust_base": {
      "description": "What a pass rests on: kernel (default) or compiler (a waived native_decide, permanent flag; F02-R9)",
      "enum": [
        "kernel",
        "compiler"
      ]
    },
    "submitter": {
      "description": "The ledger pseudonym that submitted, or the GitHub login for a hand-opened pull request; null on a local run that submitted nothing",
      "oneOf": [
        {
          "type": "null"
        },
        {
          "type": "string",
          "minLength": 1,
          "maxLength": 39
        }
      ]
    },
    "model_and_tooling": {
      "description": "As declared in the opn-submission block (D-23), or `undeclared`",
      "type": "string",
      "minLength": 1
    },
    "footprint": {
      "description": "F08-T27: step 8's reading of the proof term. `null` unless step 8 passed.",
      "oneOf": [
        {
          "type": "null"
        },
        {
          "type": "object",
          "additionalProperties": false,
          "required": [
            "nodes"
          ],
          "properties": {
            "nodes": {
              "type": "array",
              "uniqueItems": true,
              "items": {
                "type": "string",
                "minLength": 1,
                "maxLength": 200
              }
            }
          }
        }
      ]
    },
    "automation": {
      "oneOf": [
        {
          "type": "null"
        },
        {
          "$ref": "#/$defs/automation"
        }
      ],
      "description": "D-23 v3.37: the submitter's structured disclosure, copied from the opn-submission block; null when undeclared. Declared, never checked (D-1)."
    }
  },
  "$defs": {
    "identifier": {
      "type": "string",
      "pattern": "^[a-z0-9][a-z0-9-]*$"
    },
    "sha1": {
      "type": "string",
      "pattern": "^[0-9a-f]{40}$"
    },
    "sha256": {
      "type": "string",
      "pattern": "^[0-9a-f]{64}$"
    },
    "step_number": {
      "type": "integer",
      "minimum": 1,
      "maximum": 9
    },
    "diagnostic": {
      "type": "object",
      "description": "Structured, plain-string data; never rendered as markup (F00 §7)",
      "additionalProperties": false,
      "required": [
        "code",
        "message"
      ],
      "properties": {
        "code": {
          "type": "string",
          "pattern": "^[a-z][a-z0-9-]*$"
        },
        "message": {
          "type": "string"
        },
        "details": {
          "type": "object"
        },
        "truncated": {
          "type": "boolean"
        }
      }
    },
    "automation": {
      "type": "object",
      "description": "D-23 v3.37: how the artifact was produced, declared by the submitter and never verified. `method`, `models` and `framework` are required of every proof, partial and alternate (the service refuses a submission without them before any pull request opens, F25-R2); the rest is optional, and cost is what an agent can count — wall time, tokens, hardware, a free spend string — never a dollar figure a subscription cannot give.",
      "additionalProperties": false,
      "required": [
        "method",
        "models",
        "framework"
      ],
      "properties": {
        "method": {
          "enum": [
            "manual",
            "copilot",
            "agent",
            "autonomous",
            "other"
          ],
          "description": "Palomar's vocabulary: `manual`, a person wrote it; `copilot`, a person wrote it with model suggestions; `agent`, an agent wrote it under a person's direction; `autonomous`, an agent ran unattended; `other`."
        },
        "models": {
          "type": "array",
          "minItems": 1,
          "maxItems": 20,
          "items": {
            "type": "string",
            "minLength": 1,
            "maxLength": 200
          },
          "description": "Every model that contributed, by the name its provider publishes (e.g. `claude-fable-5-1`)."
        },
        "framework": {
          "type": "string",
          "minLength": 1,
          "maxLength": 200,
          "description": "The harness or framework the models ran in, with its version where known (e.g. `Claude Code 2.1`)."
        },
        "tool_setup": {
          "type": "string",
          "minLength": 1,
          "maxLength": 2000,
          "description": "Tools, plugins, orchestration, in prose."
        },
        "wall_time": {
          "type": "string",
          "minLength": 1,
          "maxLength": 200,
          "description": "How long the work took, in the submitter's words (e.g. `about 40 minutes`)."
        },
        "tokens": {
          "type": "object",
          "additionalProperties": false,
          "required": [
            "input",
            "output"
          ],
          "properties": {
            "input": {
              "type": "integer",
              "minimum": 0
            },
            "output": {
              "type": "integer",
              "minimum": 0
            }
          },
          "description": "Total tokens the models consumed and produced, when the harness reports them."
        },
        "hardware": {
          "type": "string",
          "minLength": 1,
          "maxLength": 200,
          "description": "What it ran on (e.g. `one laptop; hosted models`)."
        },
        "spend": {
          "type": "string",
          "minLength": 1,
          "maxLength": 200,
          "description": "What it cost, in the submitter's words: `subscription`, `$12.40`, `unknown`."
        }
      }
    }
  }
}
