{
  "artifact_hash": "549e5e035a79683f708d0b9ed3ee93a4f5cdc4d5a4aeee600b9665c59594571f",
  "automation": {
    "framework": "Claude Code (subagent A of a three-agent run, 2026-10-20)",
    "method": "agent",
    "models": [
      "claude-fable-5-1"
    ]
  },
  "diagnostic": null,
  "first_failing_step": null,
  "footprint": {
    "nodes": [
      "spec-5e2e0890--h1",
      "spec-5e2e0890--h2",
      "spec-ddd99827"
    ]
  },
  "gate_spec_hash": "79f34cf1d0bd952d164df6f2030ca26d0aae3a75e61f816dd2a044975ffe5c7c",
  "graph_commit": "85a80f3ef0b4412b78729fedb47c3dafa780bc73",
  "graph_id": "erdos-257",
  "lean_toolchain": "leanprover/lean4:v4.33.1",
  "mathlib_sha": "0df444a360eaa60ab8c11dca51a86af692955474",
  "merge_commit": "85a80f3ef0b4412b78729fedb47c3dafa780bc73",
  "model_and_tooling": "claude-fable-5-1 Claude Fable 5.1 claude-code",
  "network_commit": "f824b6fc425c2ce1cd0c66e158988e961f1a066f",
  "node_id": "spec-5e2e0890",
  "precheck_attestation": {
    "hash": "4c3b548c2b5242b24e08eb5debc1e6461e5f158ea580bf44434533da9c520af3",
    "signature_kind": "service"
  },
  "review": {
    "kind": "intermediate",
    "reference": null,
    "reviewer": null
  },
  "runner": "hosted",
  "schema": "attestation/v7",
  "signature": {
    "key_id": "SHA256:XOd3xiS7BYG+uqfTlo5j3uEH96wPy5SCfmBWEsAKZLI",
    "kind": "gate",
    "timestamp": "2026-10-20T22:10:31Z",
    "value": "-----BEGIN SSH SIGNATURE-----\nU1NIU0lHAAAAAQAAADMAAAALc3NoLWVkMjU1MTkAAAAg/0CrS22AvUGT9mSnPoKDoPcVUP\niyEO8YoRslzDQ33+kAAAAPb3BuLWF0dGVzdGF0aW9uAAAAAAAAAAZzaGE1MTIAAABTAAAA\nC3NzaC1lZDI1NTE5AAAAQI0MhLjnlROxdhOykNlXfnPbwhPZMfLaOua2D074APAaIByR7i\nxjNbfO/Ec2JHFtmYJGhLrmXQacI5oWk7G0+Qc=\n-----END SSH SIGNATURE-----\n"
  },
  "statement_hash": "581365b22c400a762706056562f3cdc7726dda34c5340dc15381a1ba04957c79",
  "steps": [
    {
      "diagnostic": {
        "code": "mathlib-pinned",
        "details": {
          "mathlib_sha": "0df444a360eaa60ab8c11dca51a86af692955474",
          "packages": 8
        },
        "message": "Mathlib 0df444a360ea resolved from the pinned checkout"
      },
      "name": "toolchain",
      "result": "pass",
      "step": 1
    },
    {
      "diagnostic": null,
      "name": "paths",
      "result": "pass",
      "step": 2
    },
    {
      "diagnostic": null,
      "name": "kernel-replay",
      "result": "pass",
      "step": 4
    },
    {
      "diagnostic": null,
      "name": "axioms",
      "result": "pass",
      "step": 5
    },
    {
      "diagnostic": {
        "code": "hazards-acknowledged",
        "details": {
          "acknowledged": [
            {
              "checker": "div-zero",
              "justification": "Real division; both sets exclude 0 by hypothesis, so every divisor 2^n - 1 is positive, and the junk value at n = 0 is exactly what the hypotheses 0 ∉ A, 0 ∉ B rule out (without them the statement is false: A and A ∪ {0} have equal sums).",
              "location": "1 / (2 ^ ↑n - 1)"
            }
          ]
        },
        "message": "1 hazard finding(s) acknowledged in META.yaml"
      },
      "name": "hazards",
      "result": "pass",
      "step": 6
    },
    {
      "diagnostic": null,
      "name": "witness",
      "result": "pass",
      "step": 7
    },
    {
      "diagnostic": null,
      "name": "deps",
      "result": "pass",
      "step": 8
    }
  ],
  "submitter": "fable-1020-e257-a",
  "toolchain_hash": "f54d0bc916bf76a7fae460ce9d078ccd1f74aeb4fd12c4b6546bca28b6aa1c63",
  "tooling": {
    "harness": "claude-code",
    "model": "claude-fable-5-1"
  },
  "trust_base": "kernel",
  "verdict": "pass"
}
